{
  "version": 1,
  "artifact_id": "sha256:2222222222222222222222222222222222222222222222222222222222222222",
  "created_at": "2026-08-22T12:05:00Z",
  "repository": "berlinguyinca/autospec",
  "source_spec": {
    "artifact_id": "sha256:1111111111111111111111111111111111111111111111111111111111111111",
    "digest": "sha256:eeeeeeeeeeeeeeeeeeeeeeeeeeeeeeeeeeeeeeeeeeeeeeeeeeeeeeeeeeeeeeee"
  },
  "producer": {
    "agent_id": "autospec",
    "harness": "pi",
    "bridge": "native",
    "provider_family": "local",
    "model": "deterministic",
    "session_isolation": "isolated",
    "access_mode": "read"
  },
  "issue": {
    "number": 901,
    "title": "Implement typed agent handoffs",
    "branch": "feat/pi-agent-handoffs",
    "worktree": ".",
    "claim_generation": 1
  },
  "allowed_read_paths": ["scripts/", "schemas/", "tests/pi-agent-handoff/"],
  "allowed_write_paths": ["scripts/autospec-handoff.py", "schemas/", "tests/pi-agent-handoff/"],
  "goal": "Implement typed agent handoffs.",
  "acceptance_criteria": [
    {
      "id": "AC-1",
      "text": "The handoff CLI validates all four version 1 artifact kinds.",
      "verification": "python3 -m unittest discover -s tests/pi-agent-handoff -v"
    }
  ],
  "constraints": ["AutoSpec retains merge authority."],
  "invariants": ["Unapproved specifications never reach implementation."],
  "interfaces": ["scripts/autospec-handoff.py:main"],
  "tests_required": ["unit", "integration"],
  "primary_smoke_test": "bash tests/pi-agent-handoff/test.sh",
  "limits": {
    "max_tool_calls": 40,
    "max_self_review_iterations": 3
  },
  "retry_findings": [],
  "closeout": {
    "path": ".autospec/handoffs/901/closeout.json",
    "schema": "autospec-implementation-closeout-v1.schema.json"
  },
  "route": {
    "harness": "pi",
    "model": "openai-codex/gpt-5.5",
    "reasoning_effort": "medium"
  }
}
